{
	"uid": "flipside.wad",
	"name": "Flipside, a multi-level Doom II Deathmatch WAD",
	"date": "2014-01-07 21:46:17",
	"files": [
		{
			"filename": "flipside.wad",
			"size": 555831,
			"crc": 2054822770,
			"md5": "bdf4f94b9b60f2e5190edf0e266c2640",
			"sha1": "1795204c5ab485f61521c4891756dc8c91ccb49e",
			"sha256": "918190c3ae880ef4f41c44c78dc6edbf611dec245de309e29da921475ac21a64"
		}
	]
}