{
	"uid": "db-e2m1 (8a36aa).wad",
	"version": "8a36aa",
	"date": "2014-01-04 11:56:02",
	"files": [
		{
			"filename": "db-e2m1.wad",
			"size": 67103,
			"crc": 2570041842,
			"md5": "6edb440def5f4324f99f2f18e56269bb",
			"sha1": "8a36aa4c1cc7ff0d74adcf9237efcd7da787fc53",
			"sha256": "2ae771cd3e48907c39c0f60625b99a93f9cc8efbf336489a0790439f7fad0b47"
		}
	]
}