{
	"uid": "wtc911.wad",
	"name": "Waste Treatment Center #911",
	"date": "2014-12-14 20:51:17",
	"files": [
		{
			"filename": "wtc911.wad",
			"size": 344158,
			"crc": 2964672417,
			"md5": "36fb141417388e2fee817d6d13f90854",
			"sha1": "e99d18b0967c2bf5f05eb050f731d0db99be0e10",
			"sha256": "2ef35d489298f7ddd85ee87f6dad1224078e292305ba75dda0aa7c6354117a18"
		}
	]
}