{
	"uid": "hellboundcomplex (29d2e6).wad",
	"version": "29d2e6",
	"date": "2017-03-22 20:41:10",
	"files": [
		{
			"filename": "hellboundcomplex.wad",
			"size": 2574428,
			"crc": 3767387559,
			"md5": "7239873723599763814910425ded3466",
			"sha1": "29d2e6c1f55c72233e7f6c39b8252b2c8cd4bd1e",
			"sha256": "fe9b01c2b0a6fa9803afafecd0dc01454cd1a68ad3a24c648b4709d1d8635ec3"
		}
	]
}