{
	"uid": "bldscrpt.wad",
	"name": "The bloodstorm crypt",
	"description": "You've been trapped in the crypt for a week now ever since you were trapped off from the rest of your crew. You were dispatched here to contain a alleged demon infestation of a crypt. You've been trying to contact UAC, but to no avail. It looks like they've left you for dead... Will you crawl your way out alive? Or let the darkness consume you? This is truly the hardest test you'll ever go through in your life...",
	"date": "2017-08-27 23:00:37",
	"files": [
		{
			"filename": "bldscrpt.wad",
			"size": 432395,
			"crc": 3880774705,
			"md5": "a2da4b5f9d159b36030c0369d50423e3",
			"sha1": "733a54d79b458e0333d59fb5cb0ed0ff0dead6c6",
			"sha256": "dd4992f139c4e081daa8b27f9331dc3a853a7dbeeaf7f7bc8f596de14f5e1f61"
		}
	]
}