{
	"uid": "rslquest-edthebat (68880d).wad",
	"version": "68880d",
	"date": "2014-12-11 22:21:34",
	"files": [
		{
			"filename": "rslquest-edthebat.wad",
			"size": 13332851,
			"crc": 1384040635,
			"md5": "f2dd2930c91a234a155184c3c42c367a",
			"sha1": "68880da47f80896173d69e7c6a1d93b9472b957b",
			"sha256": "c37bf72e6ac5c3c321c9072b16485d9548beba3012e985e265a2c46034ef782b"
		}
	]
}