{
	"uid": "enigma (eef3e3).wad",
	"name": "The Enigma",
	"version": "eef3e3",
	"date": "2013-11-02 16:01:51",
	"files": [
		{
			"filename": "enigma.wad",
			"size": 34681,
			"crc": 1280045295,
			"md5": "51aee2126b08b0cc6512f024f55a8c6d",
			"sha1": "eef3e3252df5923fa44ce4f29f03fc4e12c35d34",
			"sha256": "c18baa9b480e1f88770652bfb8da231325e2c873f92be9235373aa21543fe1e2"
		}
	]
}