{
	"uid": "kot-core-ce-eclipseupdate-beta-v1.7 (30a71e).pk3",
	"version": "30a71e",
	"date": "2021-01-10 03:19:13",
	"files": [
		{
			"filename": "kot-core-ce-eclipseupdate-beta-v1.7.pk3",
			"size": 25196175,
			"crc": 3217448204,
			"md5": "d159552d10c28464f3a995764c1c1163",
			"sha1": "30a71e7ab8aa6b299c8eae22e72994a3dd5c1ab0",
			"sha256": "b823a51e8d335c7b449c08cff60874f0c3f5df7ce34a4bf0a1347b551197ec24"
		}
	]
}