{
	"uid": "MAP23 (02d555).wad",
	"version": "02d555",
	"date": "2015-06-29 12:27:07",
	"files": [
		{
			"filename": "MAP23.wad",
			"size": 631146,
			"crc": 2808215546,
			"md5": "ddc1c5653b116f542a0758be42366694",
			"sha1": "02d55529b8661a49beb22deda56288711162c608",
			"sha256": "f7f11d87fd80a48e358cc72fda8ad3259c7c8728bcf9738abff343dbc4ee86d6"
		}
	]
}