{
	"uid": "FleshWizard (333297).wad",
	"version": "333297",
	"date": "2013-04-19 09:35:42",
	"files": [
		{
			"filename": "FleshWizard.wad",
			"size": 161508,
			"crc": 2741234990,
			"md5": "56947c60001d1799a1bb67620b992b00",
			"sha1": "33329761f48671bcf42014b9b6ca86b7c834d5f6",
			"sha256": "83c6d76389c4d662ccc25a8cac67a52677c2318b957f9022af81bfdebcf93fa7"
		}
	]
}