{
	"uid": "barndoom.wad",
	"name": "Barney DOOM!",
	"date": "2015-09-14 20:47:17",
	"files": [
		{
			"filename": "barndoom.wad",
			"size": 168372,
			"crc": 4048514356,
			"md5": "107b2b0473b2eaf523055f2bbbbea779",
			"sha1": "99eb6542a0a264608043fa82defadadaf073f891",
			"sha256": "6911926a7ba9ea4e3bb3cd5a967a458f71d5e39048e9b088c8468a2c00e95adf"
		}
	]
}