{
	"uid": "SOPHIL.wad",
	"name": "The Shores of Phil",
	"description": "An episode 2 theme mapset in a somewhat classic",
	"date": "2014-12-14 21:06:19",
	"files": [
		{
			"filename": "SOPHIL.wad",
			"size": 745173,
			"crc": 612577381,
			"md5": "7d0abff0629d0b24442d60d9c99eb895",
			"sha1": "20437ceeb0bce4e54cb5bf971bba265885b2065b",
			"sha256": "7be99e32dd8602267717648b645d58b0101079b63fb70be7874f346e72ff0ade"
		}
	]
}