{
	"uid": "XCALIBR!.wad",
	"name": "Excalibur 1.1",
	"date": "2014-08-30 13:50:04",
	"files": [
		{
			"filename": "XCALIBR!.wad",
			"size": 366738,
			"crc": 3462563172,
			"md5": "f3f2e0221a03a257788f01112ab88ce9",
			"sha1": "a18f87945c5ad38ae9ba5636943fdc266f3f0978",
			"sha256": "b83b7472dd8354f159c8a0bcfa47ce4fbe805b667c194c52e4f8a154804edcd7"
		}
	]
}